id;shop;adress;format;region;city
5090;5090 Одесса СМ КЗС1;"ільска рада Фонтанська, ТРЦ ""Ривьера"",  комплекс будівель та споруд №1";Супермаркет;Украинский;Одесса
5091;5091 Красноярск O'S УТ1;"г. Красноярск, ул. Телевизорная, д. 1, стр. 4, ТЦ ""Торговый Квартал""";O'STIN;Сибирский;Красноярск
5092;5092 Воронеж O'S УГС65А;"г. Воронеж, ул. Героев Сибиряков, д. 65а, ТЦ ""Армада""";O'STIN;Южно-центральный;Воронеж
5093;"5093 Ступино O'S ""Ока""";"г.Ступино, ул. Горького, вл. 26, ТЦ ""Ока""";O'STIN;Московский;Ступино
5094;"5094 Арзамас O'S ""Плаза""";"г. Арзамас, пр. Ленина, д. 129а, ТЦ ""Плаза""";O'STIN;Северо-центральный;Арзамас
5095;5095 Железногорск O'S УЛ;"г. Железногорск, ул. Ленина, д. 57, ТЦ ""Европа""";O'STIN;Южно-центральный;Железногорск(Крс)
5096;"5096 Уфа O'S СТК""Мега""";"г. Уфа, ул. Рубежная, 174, СТК ""МЕГА""";O'STIN;Уральский;Уфа
5097;5097 ТЦ «Рига Молл»;"д. Воронки, ТЦ ""Рига Молл"", Новорижское ш. 5км";Супермаркет;Московский;Москва
5098;5098 Новосибирск O'S SR;г. Новосибирск, Красный пр. д. 17, Street Retail;O'STIN;Сибирский;Новосибирск
5099;5099 Казань СМ «Мега»;"г. Казань, Победы пр-т, д. 141, ТЦ ""МЕГА""";Гипермаркет;Приволжский;Казань
5100;5100 Оренбург СМ Гулливе;"г. Оренбург, ул. Новая,  д. 4, ТЦ ""Гулливер""";Супермаркет;Приволжский;Оренбург
5101;5101 Астрахань СМ Ярмарк;"г. Астрахань, Вокзальная пл., д. 13, ТЦ ""Ярмарка""";Гипермаркет;Южный;Астрахань
5102;5102 Сыктывкар СМ Макси;"г. Сыктывкар, Октябрьский пр-т, д. 141, ТЦ ""Макси""";Супермаркет;Северо-Западный;Сыктывкар
5103;5103 Батайск O'S К9;г. Батайск, ул. Кирова, д. 9, Street Retail;O'STIN;Южный;Батайск
5104;"5104 Чита O'S ""SR""";г. Чита, ул. Ленина, д.111 Street Retail;O'STIN;Сибирский;Чита
5105;5105 Колпино СМ ТЦ«Ока»;"г. Колпино, ул. Октябрьская, д. 8, лит. А, ТЦ ""Ока""";Супермаркет;Северо-Западный;Колпино
5106;5106 Дубна СМ Маяк;"г. Дубна, пр-т Боголюбова, д. 24А, ТЦ ""Маяк""";Супермаркет;Центральный;Дубна
5107;5107 Владикавказ СМ МШ67;г. Владикавказ, Московское ш., д. 67;Супермаркет;Южный;Владикавказ
5108;5108 Одесса O'S КЗС1;"Одеська обл., Комінтернівський р., с/рада Фонтанська, Комплекс будівель та споруд № 1, ТЦ ""Рив`єра""";O'STIN;Украинский;Одесса
5109;5109 Одесса O'S Панорама;"м. Одеса, площа Незалежності, буд. 1, ТРЦ ""Панорама""";O'STIN;Украинский;Одесса
5110;5110 Киев O'S Левобережн;"м. Київ, вул. Марини Раскової, буд. 2-Б, ТЦ ""Лівобережний""";O'STIN Дисконт;Украинский;Киев
5111;5111 Запорожье O'S CityM;м. Запоріжжя, вул. Запорізька, 1б;O'STIN;Украинский;Запорожье
5112;5112 Владивосток O'S Цум;"г. Владивосток, ТЦ ""Цум"", ул. Светланская, д.29";O'STIN;Дальневосточный;Владивосток
5113;5113 К-Н-А O'S УЛ34;г.Комсомольск-на-Амуре, ул.Ленина, д.34;O'STIN;Дальневосточный;Комсомольск-на-Амуре
5114;5114 Люберцы СМ Гренада;"г. Люберцы, Новорязанское ш., д. 7, ТЦ""Гренада""";Гипермаркет;Московский;Люберцы
5115;5115 Владимир СМ Мегатор;"г. Владимир, ул. Тракторная, д. 45, ТЦ ""Мегаторг""";Гипермаркет;Центральный;Владимир
5116;5116 Орск СМ РингПлаза;"г. Орск, ул. Ленина, д. 25, ТЦ ""Ринг Плаза""";Супермаркет;Приволжский;Орск
5117;5117 Тула СМ Гостиный дв;"г. Тула, ул. Советская, д. 47, ТЦ ""Гостиный Двор""";Супермаркет;Центральный;Тула
5118;5118 К-Н-А СМ «Бум»;"г. Комсомольск-на-Амуре, ул. Димитрова, д. 14, ТЦ ""Бум""";Супермаркет;Дальневосточный;Комсомольск-на-Амуре
5119;5119 СПб O'S Балканский;"г. Санкт-Петербург, Балканская пл., д. 5 , ТЦ ""Балканский""";O'STIN;Северо-Западный;Санкт-Петербург
5120;5120 Томск O'S МираМикс;"г. Томск, пр-т Мира, д. 36, ТЦ ""МираМикс""";O'STIN;Сибирский;Томск
5121;5121 Пермь O'S 7Пятниц;г. Пермь, ул. Революции, д. 60/1;O'STIN;Уральский;Пермь
5122;5122 Омск O'S StreetReta;г. Омск, ул. Партизанская, д. 2/18 Street Retail;O'STIN;Сибирский;Омск
5123;5123 ННовгород O'S УП5;г. Нижний Новгород, ул. Плотникова, д. 5;O'STIN Дисконт;Северо-центральный;Нижний Новгород
5124;"5124 Йошкар-Ола O'S ""ДТ""";"г. Йошкар-Ола, ул. Первомайская, д. 113, ТЦ ""Дом Торговли""";O'STIN;Приволжский;Йошкар-Ола
5125;5125 Владивосток O'S С15;"г. Владивосток, ул. Семеновская, д. 15, ТЦ ""Clover House""";O'STIN;Дальневосточный;Владивосток
5126;5126 Дубна O'S Маяк;"г.Дубна, пр-т Боголюбова, д. 24А, ТЦ ""Маяк""";O'STIN;Московский;Дубна
5127;5127 Иваново O'S Тополь;"г.Иваново, ТРЦ ""Тополь"", ул. Лежневская, д.55";O'STIN;Северо-центральный;Иваново
5128;5128 Ногинск СМ ТЦ«НСП»;"г. Ногинск, ул.Соборная, д. 12, ТЦ ""На Соборной площади""";Супермаркет;Центральный;Ногинск
5129;"5129 Хабаровск O'S ""МР""";"г. Хабаровск, ул. Ким Ю Чена, д. 44, ТЦ ""Магазины Радости""";O'STIN;Дальневосточный;Хабаровск
5130;"5130 Тюмень O'S ""SR""";г. Тюмень, ул. Республики, д. 188/3, Street Retail;O'STIN;Уральский;Тюмень
5131;"5131 Колпино O'S ""Ока""";"г. Колпино, ул. Октябрьская, д. 8, литера А , ТК ""Ока""";O'STIN;Северо-Западный;Колпино
5132;5132 Первоуральск O'S Мс;"г. Первоуральск, пр-т. Космонавтов, д. 13, ТЦ ""Марс""";O'STIN;Уральский;Первоуральск
5133;5133 Кемерово O'S Радуга;"г. Кемерово, пр-т Шахтеров, д. 54, ТЦ ""Радуга""";O'STIN;Сибирский;Кемерово
5134;"5134 Тобольск O'S ""Рио""";"г.Тобольск, ул. Зона Вузов, № 4, ТЦ ""Рио""";O'STIN;Уральский;Тобольск
5135;5135 Астана СМ Тулпар;"г.Астана, ТЦ ""Тулпар"", ул. Валиханова, 24";Супермаркет;Казахстанский;Астана
5136;5136 Егорьевск O'S Форум;"г.Егорьевск, ул.Советская, дом 157, ТЦ ""Форум""";O'STIN;Московский;Егорьевск
5137;5137 Ю.Сахалинск O'S СиМ;"г.Южно-Сахалинск, п/р Хомутово, ул. 2-ая Центральная, 1 Б, ТЦ ""Сити Молл""";O'STIN;Дальневосточный;Южно-Сахалинск
5138;5138 Караганда СМ ПБЖ592;"г.Караганда, пр-т Бухар Жырау, 59/2, ТЦ ""City Mall""";Супермаркет;Казахстанский;Караганда
5139;5139 Алматы СМ УББ89А;г.Алматы, ул. Богенбай Батыра, 89 А;Супермаркет;Казахстанский;Алматы
5140;5140 Чехов O'S Карнавал;"г.Чехов, ул. Московская, вл. 96, ТРЦ ""Карнавал""";O'STIN;Московский;Чехов
5141;5141 Дмитров O'S Центр;г.Дмитров, ул.Загорская, вл. 22, ТРЦ «Центр»;O'STIN;Московский;Дмитров
5142;5142 Благовещенск O'S SR;г. Благовещенск, ул. Зейская,  д. 181, Street Retail;O'STIN;Дальневосточный;Благовещенск
5143;5143 Балаково СМ Оранж;"г. Балаково, ул. Волжская, д. 100, ТЦ ""Оранж""";Супермаркет;Приволжский;Балаково
5144;5144 СПб O'S Обводной;"г.Санкт-Петербург, ТЦ ""Обводной Канал"", наб. Обводного канала, участок 1";O'STIN;Северо-Западный;Санкт-Петербург
5145;5145 Красноярск O'S Кр-е;"г. Красноярск, пр-т газеты Красноярский рабочий, д. 120, ТЦ ""Красноярье""";O'STIN;Сибирский;Красноярск
5146;5146 Гатчина O'S Мегапол;"г. Гатчина, пр-т 25го Октября, д. 42, лит. Д, Д1, ТЦ ""Мегаполис""";O'STIN;Северо-Западный;Гатчина
5147;5147 Балаково O'S SR;г. Балаково, ул. Ленина, д. 80, Street Retail;O'STIN;Приволжский;Балаково
5148;5148 Пенза O'S Сатурн;"г. Пенза, пр-т Строителей, д. 1В, ТРЦ ""Коллаж""";O'STIN;Приволжский;Пенза
5149;5149 Ярославль СМ Москов;г. Ярославль, Московский пр-т, д. 159а/39;Гипермаркет;Центральный;Ярославль
5150;5150 СПб СМ ЛП127А;г. Санкт-Петербург, Ленинский пр-т, д.127, лит. А;Супермаркет;Северо-Западный;Санкт-Петербург
5151;5151 Барнаул O'S Весна;"г. Барнаул, ул. Малахова, д. 86в, ТРЦ ""Весна""";O'STIN;Сибирский;Барнаул
5152;5152 Пятигорск O'S SR;г. Пятигорск, ул. Октябрьская, д. 10, Street Retail;O'STIN;Южный;Пятигорск
5153;5153 Ярославль O'S Рио-2;"г.Ярославль, Тутаевское ш, д.1, ТРЦ""РИО""";O'STIN;Северо-центральный;Ярославль
5154;5154 Абакан СМ Калина;"г. Абакан, ул. Некрасова, д. 31А, ТЦ ""Калина""";Супермаркет;Сибирский;Абакан
5155;"5155 O'S ТРЦ""Азовский""";"г.Москва, ул. Азовская, д.24, кор. 3, ТРЦ ""Азовский""";O'STIN;Московский;Москва
5156;5156 Воронеж СМ Максимир;"г. Воронеж, Ленинский пр-т, д. 174, ТЦ ""Максимир""";Супермаркет;Центральный;Воронеж
5157;5157 Челябинск O'S Родни;"г. Челябинск, ул. Чайковского, Труда, 203, ТЦ ""Родник""";O'STIN;Уральский;Челябинск
5158;5158 Пенза СМ Высш Лига;"г. Пенза, ул. Московская, д. 37, ТЦ ""Высшая Лига""";Супермаркет;Приволжский;Пенза
5160;5160 Киев O'S ТРЦ Глобуc;м. Київ, Майдан Незалежності, ПТП №1, сектор В;O'STIN;Украинский;Киев
5161;5161 Черновцы O'S ТРЦ DC;"м. Чернівці, вул. Головна, буд. 265А, ТРК ""DEPO`t CENTER""";O'STIN;Украинский;Черновцы
5162;"5162 Харьков O'S ""AVE P""";"м. Харків, вул. Сумська, буд. 10, ТРЦ ""Ave Plaza""";O'STIN;Украинский;Харьков
5164;5164 Люберцы O'S Гренада;"г.Люберцы, Новорязанское ш., д.7, ТЦ ""Гренада""";O'STIN;Московский;Люберцы
5165;5165 С.Оскол СМ ТЦ«Боше»;"г. Старый Оскол, мкрн. Ольминского, д. 17, ТЦ ""Боше""";Супермаркет;Центральный;Старый Оскол
5166;5166 Петро-к O'S Рахмет;"г. Петропавловск, ул. К. Сутюшева, д. 58б, ТЦ ""Рахмет""";O'STIN;Казахстанский;Петропавловск
5167;5167 Ярославль СМ Рио;"г. Ярославль, Тутаевское ш., д. 1, ТРЦ ""Рио""";Гипермаркет;Центральный;Ярославль
5168;5168 ТЦ «Сафинат»;"г. Махачкала, пр-т Акушинского, д. 7, ТЦ ""Сафинат""";Гипермаркет;Южный;Махачкала
5169;5169 Оренбург СМ ТриКита;"г. Оренбург, ул. Туркестанская, д. 147, ТЦ ""Три Кита""";Супермаркет;Приволжский;Оренбург
5170;5170 Екатер O'S Кировски;"г. Екатеринбург, ул. Восстания, д. 50, ТЦ ""Кировский""";O'STIN;Уральский;Екатеринбург
5171;5171 Калининград O'S Лен;г. Калининград, Ленинский пр-т, д. 10-14;O'STIN;Северо-Западный;Калининград
5172;5172 В.Новгород СМ Русь;"г. Великий Новгород, ул. Большая Санкт-Петербургская, д. 25, ТЦ ""Русь""";Супермаркет;Северо-Западный;Великий Новгород
5173;5173 Орск O'S РингПлаза;"г. Орск, ТЦ ""Ринг Плаза"", ул. Ленина, д. 25";O'STIN;Приволжский;Орск
5174;5174 Электросталь O'S ПП;"г. Электросталь, ТЦ ""Парк Плаза"", ул. Корешкова, д.3";O'STIN;Московский;Электросталь
5175;5175 Астрахань O'S Ярм;"г. Астрахань, Вокзальная площадь, д. 5, ТЦ ""Ярмарка""";O'STIN;Южный;Астрахань
5176;5176 Алматы O'S Мерей;"г. Алматы, пр-т Суюмбая, д. 2, к. 3, литер А, ТЦ ""Мерей""";O'STIN Дисконт;Казахстанский;Алматы
5177;5177 Ангарск СМ Rauma+;"г. Ангарск, ТЦ ""Rauma Plus"", квартал 182, д.12";Супермаркет;Сибирский;Ангарск
5178;5178 Донецк СМ Артема;м.Донецьк, вул. Артема, буд. 147в;Супермаркет;Украинский;Донецк
5179;"5179 Мытищи O'S ТЦ ""КК""";"г. Мытищи, ТЦ ""Красный Кит"", Шараповский проезд, вл. 2";O'STIN;Московский;Мытищи
5180;5180 Балаково O'S Оранж;"г. Балаково, ул. Волжская, д. 100, ТЦ ""Оранж""";O'STIN;Приволжский;Балаково
5181;5181 С.Оскол O'S Европа;"г. Старый Оскол, пр-т. Губкина, д. 1, ТЦ ""Европа""";O'STIN;Южно-центральный;Старый Оскол
5182;5182 Миасс СМ ТРК«Слон»;г. Миасс, пр-т Автозаводцев, д. 65, ТРК «Слон»;Супермаркет;Уральский;Миасс
5184;5184 Сыктывкар O'S Макси;"г. Сыктывкар, ТРЦ ""Макси"", Октябрьский пр-т, д.141";O'STIN;Северо-Западный;Сыктывкар
5185;"5185 Тула O'S ТРЦ ""ГД""";"г. Тула, ул. Советская, д. 47, ТЦ ""Гостиный Двор""";O'STIN;Северо-центральный;Тула
5186;5186 Нижневартовск O'S Е;"г. Нижневартовск, ул. Чапаева, д. 27, ТРЦ ""Европа Сити""";O'STIN;Уральский;Нижневартовск
5187;5187 Новосибирск O'S Гд7;г. Новосибирск, ул. Гоголя, д.7;O'STIN;Сибирский;Новосибирск
5188;"5188 Саратов O'S ТЦ""С""";"Саратовская область, поселок Расково, ТЦ ""Happy Молл"", Вольский тракт, д. 2";O'STIN;Приволжский;Саратов
5189;5189 П-К O'S ГалантСити;"г. Петропавловск-Камчатский, ул. Пограничная, д. 2, ТЦ ""Галант Сити""";O'STIN;Дальневосточный;Петропавловск-Камчатский
5190;"5190 Волгодонск O'S ""ТЦ""";"г. Волгодонск, ул. Весенняя, д. 56, ТЦ ""Торговый Центр""";O'STIN;Южный;Волгодонск
5191;5191 Павлодар O'S Тд61;г. Павлодар, ул. Торайгырова, д. 61;O'STIN;Казахстанский;Павлодар
5192;5192 Нижньодніпр., 17;Дніпропетровська область, Дніпропетровський район,  селище Ювілейне, вул.Нижньодніпровська, 17;Супермаркет;Украинский;Днепропетровск
5193;"5193 Орел O'S ТЦ ""Рио""";"г. Орел, Московское ш., д. 175, ТРЦ ""Рио""";O'STIN;Южно-центральный;Орел
5194;5194 Миасс O'S Пирамида;"г. Миасс, пр. Автозаводцев, д. 65, ТЦ ""Слон""";O'STIN;Уральский;Миасс
5195;5195 СПб O'S ТРК Сенная;"г. Санкт-Петербург, Адмиралтейский р-н, ул. Ефимова, д. 3б, литер С, ТРК ""Сенная""";O'STIN;Северо-Западный;Санкт-Петербург
5196;5196 Влад-ток СМ Фортуна;"г. Владивосток, ул. Калинина, д. 277, ТЦ ""Фортуна""";Супермаркет;Дальневосточный;Владивосток
5197;5197 В-сток СМ О пр-т 98;г. Владивосток, Океанский пр-т, д. 98;Супермаркет;Дальневосточный;Владивосток
5198;5198 Юж-Сах СМ Сити-Молл;"г. Южно-Сахалинск, р-н Хомутово, ул. 2-я Центральная, д. 1б, ТРЦ ""Сити-Молл""";Супермаркет;Дальневосточный;Южно-Сахалинск
5199;"5199 Нягань O'S ТРЦ""OP""";"г. Нягань, ул. Ленина, д. 28, ТЦ ""Oasis Plaza""";O'STIN;Уральский;Нягань
5200;5200 Калуга СМ ТЦ«ТорКв»;"г. Калуга, TPЦ ""Торговый квартал"", ул.Московская 338 А";Гипермаркет;Центральный;Калуга
5201;5201 ТЦ «Форум» Мурманск;"г. Мурманск, Кольский пр-т, д. 134, ТЦ ""Форум""";Супермаркет;Северо-Западный;Мурманск
5202;5202 П-К СМ ТЦ «Мега»;"г. Петропавловск-Камчатский, ул. Тушканова, д. 35, ТЦ ""Мега""";Супермаркет;Дальневосточный;Петропавловск-Камчатский
5203;5203 Алматы СМ «A'port»;"г.Алматы, ТЦ ""A'port"", Карасайский р-н, 16 км трассы Алматы-Бишкек";Супермаркет;Казахстанский;Алматы
5204;5204 Вологда O'S ТЦР РИО;"г. Вологда, Окружное ш., д. 12, ТРЦ ""РИО""";O'STIN;Северо-центральный;Вологда
5205;5205 Тюмень СМ Па-на-ма;"г. Тюмень, ул. 2-я Луговая, д. 30, ТРЦ ""Па-на-ма""";Супермаркет;Уральский;Тюмень
5206;5206 Домодедово СМ «ТК»;"г. Домодедово, Каширское ш., стр. 3А, ТРЦ ""Торговый Квартал""";Супермаркет;Московский;Домодедово
5207;5207 ТЦ «АДК»;"г.Алматы, ул. Сатпаева, д.90, ТЦ ""АДК""";Супермаркет;Казахстанский;Алматы
5208;5208 Омск СМ ТЦ «О'Кеу»;"г. Омск, ул. Энтузиастов, д. 2, корп. 1, ТЦ ""О'Кеу""";Супермаркет;Сибирский;Омск
5209;5209 Серпухов СМ Корстон;"г. Серпухов, Борисовское ш., д. 1, ТРЦ ""Корстон""";Супермаркет;Центральный;Серпухов
5210;5210 ТЦ «Дмитровский»;"г. Дмитров, ул. Профессиональная, д. 7, ТЦ ""Дмитровский""";Супермаркет;Центральный;Дмитров
5211;5211 Красногорск O'S И;"г. Красногорск, ул. Знаменская, д. 5, ТРК ""Июнь""";O'STIN;Московский;Красногорск
5212;5212 Нижнекамск O'S Эс.;"г. Нижнекамск, ул. Гагарина, д. 25, ТЦ ""Эссен""";O'STIN;Приволжский;Нижнекамск
5213;"5213 Любня O'S ""Поворот""";"г.Лобня ТЦ ""Поворот"" , ул. Краснополянский проезд д. 2";O'STIN;Московский;Лобня
5214;"5214 Клин O'S ТЦ""Сч. 7я""";"г. Клин, ТЦ ""Счастливая 7я"", Советская пл., д.5";O'STIN;Московский;Клин
5215;"5215 Березники O'S ""ЦУМ""";"г. Березники, ул. Пятилетки, д.  41, ТЦ ""ЦУМ""";O'STIN;Уральский;Березники
5216;5216 Н.Новгород O'S РИО;"г. Нижний Новгород, Московское ш., д. 12, ТЦ ""РИО""";O'STIN;Северо-центральный;Нижний Новгород
5217;5217 Новомосковск O'S 36;г. Новомосковск ул. Комсомольская, д. 36/14;O'STIN;Северо-центральный;Новомосковск
5218;"5218 Орел O'S ТЦ ""Цум""";"г. Орел, пл. Мира, д. 1, лит. А, ТЦ ""Цум""";O'STIN;Южно-центральный;Орел
5219;"5219 Рязань O'S ТРЦ""М5""";"г. Рязань, Московское ш., 65А, ТРЦ ""М5 Молл""";O'STIN;Северо-центральный;Рязань
5220;5220 Солнечногорск O'S С;"г. Солнечногорск, ТЦ ""Сенеж"", ул. Почтовая, д.17/8";O'STIN;Московский;Солнечногорск
5221;5221 Мурманск O'S Форум;"г. Мурманск, Кольский пр-кт, д. 134, ТРЦ ""Форум""";O'STIN;Северо-Западный;Мурманск
5222;5222 Петрозаводск O'S М;"г. Петрозаводск, пр-т Ленина, д. 14, ТЦ ""Макси""";O'STIN;Северо-Западный;Петрозаводск
5223;"5223 СПб O'S ТЦ ""З К""";"г.Санкт-Петербург, Заневский пр-т, д. 67, к. 3, лит А, ТЦ ""Заневский Каскад""";O'STIN;Северо-Западный;Санкт-Петербург
5224;5224 Оренбург O'S Север;"г. Оренбург, пр-т Дзержинского, д. 23,ТЦ ""Север""";O'STIN;Приволжский;Оренбург
5225;5225 Ставрополь O'S Косм;"г.Ставрополь, ул.Доваторцев, д.75 А, ТЦ ""Космос""";O'STIN;Южный;Ставрополь
5226;5226 Винница СМ Мегамолл;м. Вiнниця, вул.600-рiччя, буд.17;Супермаркет;Украинский;Винница
5227;5227 Нягань СМ ТЦ«Oasis»;"г. Нягань, ул. Ленина, д. 28, ТЦ ""Oasis Plaza""";Супермаркет;Уральский;Нягань
5228;5228 Псков СМ «Максимус»;"г. Псков, Октябрьский пр-т, д. 54, ТЦ ""Максимус""";Супермаркет;Северо-Западный;Псков
5229;5229 Чебоксары O'S Мад-р;"г. Чебоксары, ул. Ленинского Комсомола, д. 21А, ТЦ ""Мадагаскар""";O'STIN;Приволжский;Чебоксары
5230;5230 Волгоград СМ В-ский;"г. Волгоград, ул. Рабоче-Крестьянская, д. 9Б, ТРЦ ""Ворошиловский""";Супермаркет;Южный;Волгоград
5231;5231 Улан-Удэ СМ ТЦ «В»;"г. Улан-Удэ, ул. Бабушкина, ТЦ ""Верхнеудинск""";Супермаркет;Сибирский;Улан-Удэ
5232;5232 Волгоград СМ КМолл;"г. Волгоград, ул. Землячки, д. 110б, ТРК ""КомсоМолл""";Супермаркет;Южный;Волгоград
