id;shop;adress;format;region;city
5383;5383 Владивосток O'S Ч77;"г. Владивосток, ул. Запорожская, д. 77, ТЦ ""Черёмушки""";O'STIN;Дальневосточный;Владивосток
5384;5384 ТРЦ «МЕГА»;"г. Омск, б-р Архитекторов, д. 35, ТРЦ ""МЕГА""";Супермаркет;Сибирский;Омск
5385;5385 O'S ТРЦ Глобал-Сити;"г.Москва, ул.Кировоградская, д.14, ТРЦ ""Глобал-Сити""";O'STIN;Московский;Москва
5386;5386 Орел СМ ТРЦ «РИО»;"г. Орел, Московское ш., д. 175, ТЦ ""Рио""";Супермаркет;Центральный;Орел
5387;5387 Ульяновск СМ АкваМ;"г. Ульяновск, Московское ш., д. 108, ТЦ ""Аквамолл""";Супермаркет;Приволжский;Ульяновск
5388;5388 Мытищи O'S ТЦ Июнь;"г. Мытищи, ул. Мира, стр. 51, ТРЦ ""Июнь""";O'STIN;Московский;Мытищи
5389;5389 Ульяновск СМ Оптим;"г. Ульяновск, пр-т. Ульяновский, д. 16, ТЦ ""Оптимус""";Супермаркет;Приволжский;Ульяновск
5390;5390 Астана СМ «Ажар»;"г. Астана, ул. Тэуелсиздик, д. 34, ТРЦ ""Ажар""";Супермаркет;Казахстанский;Астана
5391;5391 Киев O'S РайON;"м. Київ, вул.Лаврухіна Миколи №4 (ЛІТЕРА А), ТЦ ""РайON""";O'STIN;Украинский;Киев
5392;5392 Междуреченск СМ Южн;"г. Междуреченск, пр-д Горького, д. 14, ТЦ ""Южный""";Супермаркет;Сибирский;Междуреченск
5393;5393 Липецк O'S Европа;"г.Липецк, ТЦ ""Европа-27"", ул.Стаханова, д.36";O'STIN;Южно-центральный;Липецк
5394;5394 Хабаровск O'S Сув25;г. Хабаровск, ул. Суворова, д. 25;O'STIN;Дальневосточный;Хабаровск
5395;5395 Смоленск O'S Гал-ка;"г. Смоленск, ул. Ново-Московская, д. 2/8, ТРЦ ""Галактика""";O'STIN;Южно-центральный;Смоленск
5396;5396 Владикавказ O'S М25;г. Владикавказ, ул. Маркуса, д. 25;O'STIN;Южный;Владикавказ
5397;5397 Киев O'S пр.Об 21-б;"м. Київ, просп. Оболонський, буд. 21-Б, ТРЦ ""Dream Tоwn""";O'STIN Kids;Украинский;Киев
5398;"5398 O'S ТЦ""Калейдоскоп""";"г. Москва, Химкинский б-р, вл. 7-23, ТРЦ ""Калейдоскоп""";O'STIN;Московский;Москва
5399;"5399 Лухови O'S ТЦ""Кадо""";"г. Луховицы, ул. Пушкина, д. 125, ТРК ""КАДО""";O'STIN;Московский;Луховицы
5401;5401 Екатеринбург O'S Ок;"г. Екатеринбург, ул. Бабушкина, д. 2, ТЦ ""Окей""";O'STIN;Уральский;Екатеринбург
5402;5402 Солнечногорск O'S S;"г.Солнечногорск, ТРЦ ""Солнечный"", мкрн «Рекинцо-2», ул.Красная, д.22А";O'STIN;Московский;Солнечногорск
5403;5403 МО Путилково O'S Ок;"МО, Красногорский р-он, Путилково, ТЦ ""Окей"", 73 км. МКАД";O'STIN;Московский;Москва
5404;5404 Екатеринбург O'S ПХ;"г. Екатеринбург, ул. Сулимова, д. 50, ТЦ ""Парк Хаус""";O'STIN;Уральский;Екатеринбург
5405;5405 Нефтекамск СМ Олимп;"г. Нефтекамск, ул. Дорожная, д. 56, ТРЦ ""Олимп""";Супермаркет;Уральский;Нефтекамск
5406;5406 Сарапул СМ «Эссен»;"г. Сарапул, 3-й Дубровский пер., д. 4, ТЦ ""Эссен""";Супермаркет;Уральский;Сарапул
5407;5407 Сургут СМ ТЦ«ССМ»;"г. Сургут, ул. Югорский тракт, д.38, ТЦ ""Сургут Сити Молл""";Гипермаркет;Уральский;Сургут
5408;5408 Сургут СМ ТЦ«Аура»;"г. Сургут, Нефтеюганское ш., д. 1, ТЦ ""Аура""";Супермаркет;Уральский;Сургут
5409;5409 Челябинск СМ Горки;г. Челябинск, ул. Артиллерийская, д. 132;Гипермаркет;Уральский;Челябинск
5410;5410 Новомосковск СМ ПСЖ;г. Новомосковск, ул. Березовая, д.7 В, ТЦ «ПАССАЖ»;Супермаркет;Центральный;Новомосковск
5411;5411 Желез-жный СМ Гл2;"г. Железнодорожный, ул. Главная, д. 2, стр. 1, ТЦ ""Малахит""";Супермаркет;Московский;Железнодорожный
5412;5412 ТРЦ «Галерея»;"г. Воскресенск, ул. Октябрьская, д. 17/8, ТЦ ""Галерея""";Супермаркет;Центральный;Воскресенск
5413;5413 Тихорецк О'S О58аSR;г. Тихорецк, ул. Октябрьская, д. 58 а;O'STIN;Южный;Тихорецк
5414;5414 Котлас O'S Кристалл;"г. Котлас, ул.  Невского д.11, ул. Калинина д.14, ТЦ ""Кристалл""";O'STIN;Северо-Западный;Котлас
5415;5415 Бузулук O'S Ленина;г.Бузулук, ул.Ленина, д.53;O'STIN;Приволжский;Бузулук
5416;5416 Барнаул O'S П-ский;"г. Барнаул, Красноармейский пр-т, д. 58, ТЦ ""Первомайский""";O'STIN;Сибирский;Барнаул
5418;5418 Ульяновск O'S МШ108;"г. Ульяновск, Московское ш., д. 108, ТЦ ""AquaMall""";O'STIN;Приволжский;Ульяновск
5419;5419 СМ ТЦ«ЗВ Ростокино»;"г. Москва, пр-т Мира, д. 211, корп. 2, ТЦ ""Золотой Вавилон Ростокино""";Супермаркет;Московский;Москва
5420;5420 Новотроицк O'S Ринг;"г. Новотроицк, ул. Советская, д. 84, ТЦ ""Ринг""";O'STIN;Приволжский;Новотроицк
5421;5421 ул. Трактовая, 35;г. Иркутск, ул. Трактовая, д. 35;Гипермаркет;Сибирский;Иркутск
5422;5422 Кисловодск СМ ТЦ КР;"г. Кисловодск, ул. Горького, д. 14, ТЦ ""Кристалл""";Супермаркет;Южный;Кисловодск
5423;5423 Нижний Тагил O'S ММ;"г.Нижний Тагил, ТЦ ""МегаМарт"", Ленинградский просп. 28";O'STIN;Уральский;Нижний Тагил
5424;5424 Анжеро-Судженск O'S;"г. Анжеро-Судженск, ул. Ленина, д. 13А, ТЦ ""Сибирский городок""";O'STIN;Сибирский;Анжеро-Судженск
5425;"5425 Глазов O'S ""Пассаж""";"г. Глазов, пл. Свободы, д. 1, ТЦ ""Пассаж""";O'STIN;Уральский;Глазов
5426;5426 Волгодонск O'S М86;г. Волгодонск, ул. Морская, д. 86, стр. 4, Street Retail;O'STIN;Южный;Волгодонск
5427;"5427 Уфа O'S ""Планета""";"г.Уфа, ТРЦ ""Планета"", пр-т Салавата Юлаева";O'STIN;Уральский;Уфа
5428;5428 Гусь-Хруст. O'S ТЦР;"г. Гусь-Хрустальный, ул. Рудницкой, д. 3, ТЦ ""Радуга""";O'STIN;Северо-центральный;Гусь-Хрустальный
5429;"5429 Саров O'S ТЦ ""Атом""";"г. Саров, ул. Силкина, д. 31, ТЦ ""Атом""";O'STIN;Северо-центральный;Саров
5430;"5430 Щелково O'S ""Ладья""";"МО, г. Щелково, Пролетарский пр-т, д. 4, корп. 3, ТЦ ""Ладья""";O'STIN;Московский;Щелково
5431;"5431 СПб O'S ТЦ ""Парад""";"г. Санкт-Петербург, ул. Прибрежная, д. 18, лит. А, ТЦ ""Парад""";O'STIN;Северо-Западный;Санкт-Петербург
5432;5432 Нижнекамск O'S ТЦ Р;"г. Нижнекамск, пр-т Химиков, д. 49, ТЦ ""РаМус""";O'STIN;Приволжский;Нижнекамск
5433;5433 Невинномысск СМ ТЦМ;"г. Невинномысск, ул. Революционная, д. 57А, ТЦ ""Максимум""";Супермаркет;Южный;Невинномысск
5434;5434 Ангарск СМ Rauma+12;"г. Ангарск, квартал 182, д. 12, ТЦ ""Rauma Plus""";Супермаркет;Сибирский;Ангарск
5435;"5435 O'S ""Облака"" Kids";"г.Москва, ТРЦ ""Облака"", Ореховый б-р, д.22";O'STIN Kids;Московский;Москва
5436;5436 Котельники O'S МБДК;"г. Котельники, 17-й км МКАД, 1-ый Покровский пр-д, д. 1, ТРЦ ""МЕГА Белая Дача""";O'STIN Kids;Московский;Москва
5437;5437 Коломна O'S Кадо K;"г. Коломна, пл. Восстания, д. 7, ТЦ ""КАДО""";O'STIN Kids;Московский;Коломна
5438;"5438 Орел O'S ""Гринн"" К";"г. Орел, Кромское ш., д. 4, ТМК ""Гринн""";O'STIN Kids;Южно-центральный;Орел
5440;5440 Красноярск O'S TK K;г. Красноярск, ул. Телевизорная, д. 1, стр. 4, ТРК «Торговый квартал на Свободном» «KIDS»;O'STIN Kids;Сибирский;Красноярск
5441;5441 СПб O'S ГрандКаньон;"г. Санкт-Петербург, пр-т Энгельса, д. 154  лит. А, ТЦ ""Гранд Каньон""";O'STIN Kids;Северо-Западный;Санкт-Петербург
5442;5442 Барнаул СМ ТЦ«Огни»;"г. Барнаул, ул. Антона Петрова, д. 219 б, ТЦ ""Огни""";Супермаркет;Сибирский;Барнаул
5443;5443 Кривой рог СМ 30лП;м. Кривий Ріг, пл. 30-річчя Перемоги, б.1;Супермаркет;Украинский;Кривой Рог
5444;5444 Зеленоград СМ Ольга;"г. Зеленоград, Панфиловский пр-т, корп. 1104, ТЦ ""Ольга""";Супермаркет;Московский;Зеленоград
5445;5445 Зеленог. СМ Столица;"г. Зеленоград, 14-й мкрн., корп. 1446, ТЦ ""Столица""";Супермаркет;Московский;Зеленоград
5446;5446 ТРЦ «Мармелад»;"г. Таганрог, пл. Мира, д. 7, ТРЦ ""Мармелад""";Супермаркет;Южный;Таганрог
5447;5447 Серов СМ Каквинская;г. Серов, ул. Каквинская, д. 30;Супермаркет;Уральский;Серов
5448;5448 Оренбург СМ «Север»;"г. Оренбург, пр-т Дзержинского, д. 23, ТРЦ ""Север""";Супермаркет;Приволжский;Оренбург
5449;5449 Альметьевск СМ Л128;г. Альметьевск, ул. Ленина, д. 128;Супермаркет;Приволжский;Альметьевск
5450;5450 Новокузнецк СМ «СГ»;"г. Новокузнецк, ул. Рихарда Зорге, д. 17, ТЦ ""Сибирский городок""";Супермаркет;Сибирский;Новокузнецк
5451;5451 Канск O'S 40 лет О;"г. Канск, ул. 40- летия Октября, д. 62, ТЦ ""Порт Артур""";O'STIN;Сибирский;Канск
5452;5452 Саранск СМ ТЦ «Рио»;"г. Саранск, ул. Советская, д. 55А, ТЦ ""Рио""";Супермаркет;Приволжский;Саранск
5453;"5453 Винница O'S ТЦ ""М""";"м. Вінниця, вул. Козицького, буд. 51, ТЦ ""Sky Park""";O'STIN;Украинский;Винница
5454;"5454 Химки O'S ТЦ ""Лига""";"г. Химки, Ленинградское ш., владение 5, ТЦ ""Лига""";O'STIN;Московский;Химки
5455;5455 O'S Александр Лэнд;"г. Москва, ул. Пришвина, д. 22, ТЦ ""Александр Лэнд""";O'STIN;Московский;Москва
5456;5456 ул.Толи Би, 296;г. Алматы, ул.Толи Би, д. 296;Супермаркет;Казахстанский;Алматы
5457;"5457 Симферополь O'S ""Ц""";"м. Сімферополь, вул. Севастопольська, буд. 62, ТК ""Центрум""";O'STIN;Украинский;Симферополь
5458;5458 ТЦ «АВАНГАРД»;"г. Ханты-Мансийск, ул. Энгельса, д. 43, ТЦ ""АВАНГАРД""";Супермаркет;Уральский;Ханты-Мансийск
5459;5459 ул. Суворова, 19;г. Хабаровск, ул. Суворова, д. 19;Супермаркет;Дальневосточный;Хабаровск
5460;5460 Краснореченская, 94;г. Хабаровск, ул. Краснореченская, д. 94;Гипермаркет;Дальневосточный;Хабаровск
5461;5461 Хабаровск СМ КЮЧ44;г. Хабаровск, ул. Ким Ю Чена, д. 44;Супермаркет;Дальневосточный;Хабаровск
5462;5462 Зеленогорск O'S СГ;"г. Зеленогорск, ул. Песчаная, д. 2, Лит. Б, ТЦ ""Сибирский Городок""";O'STIN;Сибирский;Зеленогорск
5463;5463 Борщагівська, 154;м. Київ, вул. Борщагівська, буд. 154;Супермаркет;Украинский;Киев
5464;5464 Нижневартовск СМ Ч;г. Нижневартовск, ул. Чапаева, д. 40;Супермаркет;Уральский;Нижневартовск
5465;5465 Медведковский;"г. Москва, ул. Широкая, д. 13А, ТЦ ""Медведковский""";O'STIN;Московский;Москва
5466;5466 Петропавловск СМ КС;"г. Петропавловск, ул. К. Сутюшева, д. 58 Б, ТЦ ""Рахмет""";Супермаркет;Казахстанский;Петропавловск
5467;5467 Глазов СМ Сов34;г. Глазов, ул. Советская, д. 34;Супермаркет;Уральский;Глазов
5468;5468 Вологда СМ Панорама;"г. Вологда, ул. Чехова, д. 27, ТЦ ""Панорама""";Супермаркет;Центральный;Вологда
5470;5470 Екатеринбург СМ К98;г. Екатеринбург, пр-т Космонавтов, д. 98 Б;Супермаркет;Уральский;Екатеринбург
5471;"5471 Сургут O'S ТЦ""ССМ""";"г. Сургут, Югорский тракт, д.38, ТЦ ""Сургут Сити Молл""";O'STIN;Уральский;Сургут
5472;5472 Красногорск O'S СР;"г. Красногорск, ул. Ленина, д. 35, ТЦ ""Солнечный Рай""";O'STIN;Московский;Красногорск
5473;5473 Пенза СМ ТЦ Коллаж;"г. Пенза, пр-т Строителей, д. 1В, ТРК ""Коллаж""";Супермаркет;Приволжский;Пенза
5474;5474 СМ ТЦ «Ясенево»;"г. Москва, Литовский б-р, д. 22, ТЦ ""Ясенево""";Супермаркет;Московский;Москва
5475;5475 Кам_Ур O'S Победы31;г. Каменск-Уральский, пр-т Победы, д. 31;O'STIN;Уральский;Каменск-Уральский
5476;5476 Кстово O'S Восторг;"г. Кстово, ул. Зелёная, д. 24, ТРЦ ""Восторг""";O'STIN;Северо-центральный;Кстово
5477;5477 Саров СМ ТЦ«Атом»;"г. Саров, ул. Силкина, д. 31, ТЦ ""Атом""";Супермаркет;Центральный;Саров
5478;5478 Смоленск СМ Галакт.;"г. Смоленск, ул. Новомосковская, д. 2/8, ТЦ ""Галактика""";Супермаркет;Центральный;Смоленск
5479;5479 Лыткарино O'S Весна;"г. Лыткарино, ул. Парковая, стр. 2, ТРЦ ""Весна""";O'STIN;Московский;Лыткарино
5480;"5480 СМ ТЦ ""Виктория""";"г. Москва, ТЦ ""Виктория"", ул. Адмирала Лазарева, 2";Супермаркет;Московский;Москва
5481;"5481 Орск O'S ТЦ ""ЦУМ"" К";"г. Орск, ул. Васнецова, д. 16, ТЦ ""ЦУМ""";O'STIN Kids;Приволжский;Орск
5482;"5482 Абакан O'S ""Калина""";"г. Абакан, ул. Некрасова, д. 31 А, ТЦ ""Калина""";O'STIN;Сибирский;Абакан
5483;5483 Нефтекамск O'S Л21;г. Нефтекамск, ул. Ленина, д. 21;O'STIN;Уральский;Нефтекамск
5484;5484 Зл O'S Панфиловский;"г. Зеленоград, Панфиловский пр-т, д. 6а, ТЦ ""Панфиловский""";O'STIN;Московский;Зеленоград
5485;5485 Челябинск O'S Урал;"г. Челябинск, ул. Воровского, д. 6, ТЦ ""Урал""";O'STIN Дисконт;Уральский;Челябинск
5486;5486 Ростов-на-Д O'S Вав;"г. Ростов-на-Дону, пр-т Космонавтов, д. 2/2, ТРК ""Вавилон""";O'STIN Дисконт;Южный;Ростов-на-Дону
5487;5487 Тольятти O'S ПаркХа;"г. Тольятти, Автозаводское ш., д. 6, ТРЦ ""Парк Хаус""";O'STIN;Приволжский;Тольятти
5488;5488 Запорожье СМ Лен146;м. Запорiжжя, пр-т Ленiна, буд. 146;Супермаркет;Украинский;Запорожье
5489;5489 Киев СМ Горького176;м. Київ, вул. Горького, буд. 176;Супермаркет;Украинский;Киев
5490;5490 Якутск СМ «ГрандС2»;"г. Якутск, ул. Федора Попова, д. 17, ТЦ ""Дэлэй""";Супермаркет;Дальневосточный;Якутск
5491;5491 Челябинск СМ ТЦ«КС»;"г. Челябинск, ул. Черкасская, д. 15, ТЦ ""КС""";Супермаркет;Уральский;Челябинск
5492;5492 Апатиты O'S Дзер39;г. Апатиты, ул. Дзержинского, д. 39, Street Retail;O'STIN;Северо-Западный;Апатиты
5493;5493 Улан-Удэ O'S Пионер;"г. Улан-Удэ, ул. Корабельная, д. 32, ТРЦ ""Пионер""";O'STIN;Сибирский;Улан-Удэ
5494;5494 Егорьевск СМ Сов4/4;г. Егорьевск, ул. Советская, д. 4, стр. 4;Супермаркет;Центральный;Егорьевск
5495;5495 Петро-К СМ «Глобус»;"г. Петропавловск-Камчатский, ул. Вулканная, д. 59, ТЦ ""Глобус""";Супермаркет;Дальневосточный;Петропавловск-Камчатский
5496;5496 Череповец СМ Макси;"г. Череповец, пр-т Победы, д. 200, ТЦ ""Макси""";Супермаркет;Центральный;Череповец
5497;5497 Костанай СМ ТЦ«ЦУМ»;"г. Костанай, пр-т Аль-Фараби, д. 65, ТЦ ""ЦУМ""";Супермаркет;Казахстанский;Костанай
5498;5498 ТРЦ «City Mall»;"г. Темиртау, пр-т Металлургов, ТЦ ""City Mall""";Супермаркет;Казахстанский;Темиртау
5499;5499 Херсон СМЗалаэгер18;м. Херсон, вул. Залаегерсег, буд. 18;Супермаркет;Украинский;Херсон
5500;5500 Королев O'S Лунаход;"г. Королев, пр. Космонавтов, д. 23/37, ТЦ ""Лунаход""";O'STIN;Московский;Королев
5501;5501 Ивантеевка O'S Сов2;"г. Ивантеевка, Советский пр-т, д. 2а, ТЦ ""Гагарин""";O'STIN;Московский;Ивантеевка
5502;"5502 Ишим O'S ТЦ ""Мечта""";"г. Ишим, ул. Свердлова, 1г, ТЦ ""Мечта""";O'STIN;Уральский;Ишим
5503;5503 СПб O'S Шкипер Молл;"г. Санкт-Петербург, Малый пр-т, д. 88, ТЦ ""Шкиперский Молл""";O'STIN;Северо-Западный;Санкт-Петербург
5504;5504 Горно-Алтай O'S МРа;"г. Горно-Алтайск, ТЦ ""Мария Ра""";O'STIN;Сибирский;Горно-Алтайск
5505;5505 Н.Челны O'S СитиМол;"г. Набережные Челны, пр-т Чулман, д. 89/57, ТЦ ""Сити Молл""";O'STIN;Приволжский;Набережные Челны
5506;"5506 O'S ТЦ ""Круг""";"г. Москва, ТЦ ""Круг""";O'STIN;Московский;Москва
5507;5507 ТЦ «Билла»;"г. Чехов, ул. Полиграфистов, д. 21/1,  ТЦ ""Билла""";Супермаркет;Центральный;Чехов
5508;5508 Киев O'S ПроменадаП;"м. Київ, вул. Велика Окружна, буд. 4, ТРЦ ""PROMENADA PARK""";O'STIN;Украинский;Киев
5509;5509 Днепро O'S Караван;"Дніпропетровський р., смт Ювілейне, вул. Нижньодніпровська, буд. 17, ТРЦ ""Караван""";O'STIN;Украинский;Днепропетровск
5510;5510 Киев O'S Мармелад;м. Київ, вул. Борщагівська, буд. 154;O'STIN;Украинский;Киев
5511;5511 Киев O'S ОкеанПлаза;м. Київ, вул. Горького, буд. 176;O'STIN;Украинский;Киев
5512;5512 Херсон O'S Фабрика;"м. Херсон, вул. Залаегерсег, буд. 18, ТРЦ ""Fabrika""";O'STIN;Украинский;Херсон
5513;5513 Череповец O'S Лен88;г. Череповец, ул. Ленина, д. 88;O'STIN;Северо-центральный;Череповец
5514;5514 Махачкала O'S СП;"г. Махачкала, пр-т Гамидова, д. 18 Ж, ТЦ ""Вегас""";O'STIN;Южный;Махачкала
5515;5515 Димитровг СМ Винтаж;"г. Димитровград, ул. Куйбышева, д. 166, ТЦ ""Винтаж""";Супермаркет;Приволжский;Димитровград
5516;5516 Оренбург O'S Север;"г. Оренбург, пр-т Дзержинского, д. 23, ТЦ ""Север""";O'STIN Kids;Приволжский;Оренбург
5517;5517 Радужный О'S Подсол;"г. Радужный, 4-й мкрн., ул. Ягельная, стр. 18а, ТЦ ""Подсолнух""";O'STIN;Уральский;Радужный
5518;5518 Череповец O'S Макси;г. Череповец, пр-т Победы, д. 200, ТЦ “Макси”;O'STIN;Северо-центральный;Череповец
5519;5519 ТЦ «Медео»;"г. Красноярск, пр-т им. Газеты Красноярский рабочий,  д. 74, ТЦ ""Медео""";Супермаркет;Сибирский;Красноярск
5520;5520 СПб СМ «ШкиперМолл»;"г. Санкт-Петербург, Малый пр-т В.о., д. 88, лит. А, ТЦ ""Шкиперский Молл""";Супермаркет;Северо-Западный;Санкт-Петербург
5521;5521 СМ ТЦ«Перовский»;"г. Москва, Свободный пр-т, д. 33, ТЦ ""Перовский""";Супермаркет;Московский;Москва
5522;5522 СМ Наш Гипер  47км;"г. Москва, МКАД 47-й км., стр. 20, ТЦ ""Наш гипермаркет""";Гипермаркет;Московский;Москва
5523;5523 Талдыкорган O'S ЦУМ;"г. Талдыкорган, ул. Таулелсыздык, д. 46, ТЦ ""ЦУМ""";O'STIN;Казахстанский;Талдыкорган
5524;5524 Октябрьский CM Ос6А;"г. Октябрьский, ул. Островского, д. 6А, ТЦ ""Аструм""";Супермаркет;Уральский;Октябрьский
5525;5525 Нальчик O'S ТЦ Дея;"г. Нальчик, ул. Кирова, д. 320,  ТЦ ""Дея""";O'STIN;Южный;Нальчик
5526;"5526 Кириши O'S ""Ладога""";"г. Кириши, пр-т Героев, д. 11, ТК ""Ладога""";O'STIN;Северо-Западный;Кириши
5527;5527 Уфа O'S Планета;"г. Уфа, пр-т Салавата Юлаева, МОСК ""Планета""";O'STIN Kids;Уральский;Уфа
5528;5528 Курск СМ «Европа19»;"г. Курск, ул. Студенческая, д. 1, ТЦ ""Европа 19""";Супермаркет;Центральный;Курск
